"code","id","account_type","reconcile","name","chart_template_id/id"
"010000","hr_010000","asset_non_current",0,"Izdatci za razvoj","l10n_hr_coa_rrif_2022.l10n_hr_coa_rrif_2022"
"011000","hr_011000","asset_non_current",0,"Koncesije, patenti, licencije, robne i uslužne marke","l10n_hr_coa_rrif_2022.l10n_hr_coa_rrif_2022"
"012000","hr_012000","asset_non_current",,"Ulaganje u računalni softver","l10n_hr_coa_rrif_2022.l10n_hr_coa_rrif_2022"
"012010","hr_012010","asset_non_current",,"Ulaganje u internetske stranice","l10n_hr_coa_rrif_2022.l10n_hr_coa_rrif_2022"
"012100","hr_012100","asset_non_current",,"Ulaganje u autorska i dr. prava korištenja","l10n_hr_coa_rrif_2022.l10n_hr_coa_rrif_2022"
"012110","hr_012110","asset_non_current",,"Ulaganje u znanje (know-how), dizajn","l10n_hr_coa_rrif_2022.l10n_hr_coa_rrif_2022"
"012140","hr_012140","asset_non_current",,"Ulaganje u dugogodišnje pravo uporabe (prema ugovoru) - npr. višegod. plaćeni zakup","l10n_hr_coa_rrif_2022.l10n_hr_coa_rrif_2022"
"012150","hr_012150","asset_non_current",,"Ulaganje u pravo suvlasništva opreme","l10n_hr_coa_rrif_2022.l10n_hr_coa_rrif_2022"
"012220","hr_012220","asset_non_current",,"Ostala dugogodišnja prava","l10n_hr_coa_rrif_2022.l10n_hr_coa_rrif_2022"
"014000","hr_014000","asset_non_current",0,"Ostala nematerijalna imovina","l10n_hr_coa_rrif_2022.l10n_hr_coa_rrif_2022"
"015000","hr_015000","asset_non_current",0,"Predujmovi za nabavu nematerijalne imovine","l10n_hr_coa_rrif_2022.l10n_hr_coa_rrif_2022"
"016000","hr_016000","asset_non_current",0,"Kriptovalute","l10n_hr_coa_rrif_2022.l10n_hr_coa_rrif_2022"
"017000","hr_017000","asset_non_current",0,"Nematerijalna imovina u pripremi (analitika prema vrsti računa skupine 01)","l10n_hr_coa_rrif_2022.l10n_hr_coa_rrif_2022"
"019000","hr_019000","asset_non_current",0,"Akumulirana amortizacija nematerijalne imovine","l10n_hr_coa_rrif_2022.l10n_hr_coa_rrif_2022"
"020000","hr_020000","asset_fixed",0,"Zemljišta","l10n_hr_coa_rrif_2022.l10n_hr_coa_rrif_2022"
"021000","hr_021000","asset_fixed",0,"Zemljišna prava (višegodišnja)","l10n_hr_coa_rrif_2022.l10n_hr_coa_rrif_2022"
"023000","hr_023000","asset_fixed",0,"Građevinski objekti (za vlastite potrebe)","l10n_hr_coa_rrif_2022.l10n_hr_coa_rrif_2022"
"024000","hr_024000","asset_fixed",0,"Stanovi za vlastite zaposlenike","l10n_hr_coa_rrif_2022.l10n_hr_coa_rrif_2022"
"026000","hr_026000","asset_fixed",0,"Predujmovi za nabavu nekretnina","l10n_hr_coa_rrif_2022.l10n_hr_coa_rrif_2022"
"027000","hr_027000","asset_fixed",0,"Nekretnine u pripremi","l10n_hr_coa_rrif_2022.l10n_hr_coa_rrif_2022"
"028000","hr_028000","asset_fixed",0,"Vrijednosno usklađenje nekretnina","l10n_hr_coa_rrif_2022.l10n_hr_coa_rrif_2022"
"029000","hr_029000","asset_fixed",0,"Akumulirana amortizacija građevina","l10n_hr_coa_rrif_2022.l10n_hr_coa_rrif_2022"
"030000","hr_030000","asset_fixed",0,"Postrojenja","l10n_hr_coa_rrif_2022.l10n_hr_coa_rrif_2022"
"031000","hr_031000","asset_fixed",0,"Uredska oprema (fotokopirni aparati, telefaksi, blagajne, alarmi, klimatizacijski uređaji, hladnjaci, televizori, i dr.)","l10n_hr_coa_rrif_2022.l10n_hr_coa_rrif_2022"
"031100","hr_031100","asset_fixed",0,"Računalna oprema","l10n_hr_coa_rrif_2022.l10n_hr_coa_rrif_2022"
"031200","hr_031200","asset_fixed",0,"Telekomunikacijska oprema (mobiteli, tel. centrale, antene i sl.)","l10n_hr_coa_rrif_2022.l10n_hr_coa_rrif_2022"
"031300","hr_031300","asset_fixed",0,"Oprema trgovine (blagajne, hladnjaci, i dr.)","l10n_hr_coa_rrif_2022.l10n_hr_coa_rrif_2022"
"031400","hr_031400","asset_fixed",0,"Oprema ugostiteljstva, hotela i sl. (aparati, štednjaci, hladnjaci, pokućstvo i sl.)","l10n_hr_coa_rrif_2022.l10n_hr_coa_rrif_2022"
"031500","hr_031500","asset_fixed",0,"Oprema servisa (dizalice, ispitni uređaji, aparati i dr.)","l10n_hr_coa_rrif_2022.l10n_hr_coa_rrif_2022"
"031600","hr_031600","asset_fixed",0,"Oprema za graditeljstvo i montažu (kranovi, bageri, skele, oplate, miješalice, dizalice, valjci i sl.)","l10n_hr_coa_rrif_2022.l10n_hr_coa_rrif_2022"
"031700","hr_031700","asset_fixed",0,"Oprema (aparati) grijanja/hlađenja","l10n_hr_coa_rrif_2022.l10n_hr_coa_rrif_2022"
"031800","hr_031800","asset_fixed",0,"Oprema zaštite na radu i protupožarne zaštite","l10n_hr_coa_rrif_2022.l10n_hr_coa_rrif_2022"
"031900","hr_031900","asset_fixed",0,"Ostala oprema i oprema izvan uporabe","l10n_hr_coa_rrif_2022.l10n_hr_coa_rrif_2022"
"032000","hr_032000","asset_fixed",0,"Alati, pogonski inventar i transportna imovina","l10n_hr_coa_rrif_2022.l10n_hr_coa_rrif_2022"
"032000","hr_032000","asset_fixed",0,"Putnička vozila (osobna i putnički kombi) i motor kotači","l10n_hr_coa_rrif_2022.l10n_hr_coa_rrif_2022"
"033000","hr_033000","asset_fixed",0,"50% pretporeza od osobnih automobila","l10n_hr_coa_rrif_2022.l10n_hr_coa_rrif_2022"
"033100","hr_033100","asset_fixed",0,"50% i 100% pretporeza od osobnih automobila (n. v. veće od 400.000,00 kn koji su nabavljeni do 31.12.2018.)","l10n_hr_coa_rrif_2022.l10n_hr_coa_rrif_2022"
"033200","hr_033200","asset_fixed",0,"50% pretporeza od brodova, jahti i dr.","l10n_hr_coa_rrif_2022.l10n_hr_coa_rrif_2022"
"033300","hr_033300","asset_fixed",0,"50% i 100% pretporeza od brodova, jahti i dr. (n.v. veće od 400.000,00 kn koji su nabavljeni do 31.12.2018.)","l10n_hr_coa_rrif_2022.l10n_hr_coa_rrif_2022"
"034000","hr_034000","asset_fixed",0,"Poljoprivredna oprema i mehanizacija","l10n_hr_coa_rrif_2022.l10n_hr_coa_rrif_2022"
"035000","hr_035000","asset_fixed",0,"Ostala materijalna imovina","l10n_hr_coa_rrif_2022.l10n_hr_coa_rrif_2022"
"036000","hr_036000","asset_fixed",0,"Predujmovi za materijalnu imovinu","l10n_hr_coa_rrif_2022.l10n_hr_coa_rrif_2022"
"037000","hr_037000","asset_fixed",0,"Materijalna imovina u pripremi","l10n_hr_coa_rrif_2022.l10n_hr_coa_rrif_2022"
"038000","hr_038000","asset_fixed",0,"Vrijednosno usklađenje postrojenja i opreme","l10n_hr_coa_rrif_2022.l10n_hr_coa_rrif_2022"
"039000","hr_039000","asset_fixed",0,"Akumulirana amortizacija postrojenja i opreme","l10n_hr_coa_rrif_2022.l10n_hr_coa_rrif_2022"
"039100","hr_039100","asset_non_current",0,"Akumulirana amortiz. opreme","l10n_hr_coa_rrif_2022.l10n_hr_coa_rrif_2022"
"039200","hr_039200","asset_non_current",0,"Akumulirana amortiz. alata, pogonskog inventara i transportnih sredstava","l10n_hr_coa_rrif_2022.l10n_hr_coa_rrif_2022"
"039300","hr_039300","asset_non_current",0,"Akumulirana amortiz. osobnih automobila, plovila i zrakoplova (nabavna vrijednost bez PDV-a)","l10n_hr_coa_rrif_2022.l10n_hr_coa_rrif_2022"
"039500","hr_039500","asset_non_current",0,"Akumulirana amortiz. 50% pretporeza od osob. automobila","l10n_hr_coa_rrif_2022.l10n_hr_coa_rrif_2022"
"039600","hr_039600","asset_non_current",0,"Akumulirana amortiz. 50% i 100% pretporeza od osob. automobila (n. v. veće od 400.000,00 kn koji su nabavljeni do 31. 12. 2018.)","l10n_hr_coa_rrif_2022.l10n_hr_coa_rrif_2022"
"039700","hr_039700","asset_non_current",0,"Akumulirana amortiz. 50% od pretporeza od brodova, jahti i dr. sred. za osobni prijevoz","l10n_hr_coa_rrif_2022.l10n_hr_coa_rrif_2022"
"039800","hr_039800","asset_non_current",0,"Akumulirana amortiz. 50% i 100% pretporeza od brodova, jahti i dr. sred. za osobni prijevoz (n. v. veće od 400.000,00 kn koji su nabavljeni do 31. 12. 2018.)","l10n_hr_coa_rrif_2022.l10n_hr_coa_rrif_2022"
"039900","hr_039900","asset_non_current",0,"Ostala akumulirana amortizacija za opremu","l10n_hr_coa_rrif_2022.l10n_hr_coa_rrif_2022"
"040000","hr_040000","asset_non_current",0,"Biološka imovina - bilje - višegodišnji nasadi","l10n_hr_coa_rrif_2022.l10n_hr_coa_rrif_2022"
"041000","hr_041000","asset_current",0,"Biološka imovina - životinje - osnovno stado","l10n_hr_coa_rrif_2022.l10n_hr_coa_rrif_2022"
"046000","hr_046000","asset_non_current",0,"Predujmovi za biološku imovinu","l10n_hr_coa_rrif_2022.l10n_hr_coa_rrif_2022"
"047000","hr_047000","asset_non_current",0,"Biološka imovina u pripremi","l10n_hr_coa_rrif_2022.l10n_hr_coa_rrif_2022"
"048000","hr_048000","asset_non_current",0,"Vrijednosno usklađenje biološke imovine","l10n_hr_coa_rrif_2022.l10n_hr_coa_rrif_2022"
"049000","hr_049000","asset_non_current",0,"Akumulirana amortizacija biološke imovine","l10n_hr_coa_rrif_2022.l10n_hr_coa_rrif_2022"
"050000","hr_050000","asset_non_current",0,"Ulaganja u nekretnine - zemljišta","l10n_hr_coa_rrif_2022.l10n_hr_coa_rrif_2022"
"051000","hr_051000","asset_non_current",0,"Ulaganja u nekretnine - građevine","l10n_hr_coa_rrif_2022.l10n_hr_coa_rrif_2022"
"056000","hr_056000","asset_non_current",0,"Predujmovi za ulaganja u nekretnine","l10n_hr_coa_rrif_2022.l10n_hr_coa_rrif_2022"
"057000","hr_057000","asset_non_current",0,"Ulaganja u nekretnine u pripremi","l10n_hr_coa_rrif_2022.l10n_hr_coa_rrif_2022"
"058000","hr_058000","asset_non_current",0,"Vrijednosno usklađenje ulaganja u nekretnine","l10n_hr_coa_rrif_2022.l10n_hr_coa_rrif_2022"
"059000","hr_059000","asset_non_current",0,"Akumulirana amortizacija ulaganja u građevine","l10n_hr_coa_rrif_2022.l10n_hr_coa_rrif_2022"
"060000","hr_060000","asset_non_current",0,"Ulaganja u udjele (dionice) i ostale vrijednosne papire poduzetnika unutar grupe","l10n_hr_coa_rrif_2022.l10n_hr_coa_rrif_2022"
"060100","hr_060100","asset_non_current",0,"Ulaganja u ostale vrijednosne papire poduzetnika unutar grupe","l10n_hr_coa_rrif_2022.l10n_hr_coa_rrif_2022"
"062000","hr_062000","asset_non_current",0,"Ulaganja u udjele (dionice) i ostale vrijednosne papire društava povezanih sudjelujućim interesom","l10n_hr_coa_rrif_2022.l10n_hr_coa_rrif_2022"
"063000","hr_063000","asset_non_current",0,"Dani zajmovi, depoziti i slično društvima povezanim sudjelujućim interesom","l10n_hr_coa_rrif_2022.l10n_hr_coa_rrif_2022"
"064000","hr_064000","asset_non_current",0,"Ulaganja u vrijednosne papire (dugotrajne)","l10n_hr_coa_rrif_2022.l10n_hr_coa_rrif_2022"
"065000","hr_065000","asset_non_current",0,"Dani zajmovi, depoziti i sl.","l10n_hr_coa_rrif_2022.l10n_hr_coa_rrif_2022"
"066000","hr_066000","asset_non_current",0,"Ulaganja koja se obračunavaju metodom udjela","l10n_hr_coa_rrif_2022.l10n_hr_coa_rrif_2022"
"067000","hr_067000","asset_non_current",0,"Ostala dugotrajna financijska imovina","l10n_hr_coa_rrif_2022.l10n_hr_coa_rrif_2022"
"068000","hr_068000","asset_non_current",0,"Vrijednosno usklađenje financijske imovine - dugotrajne (analitika prema oblicima imovine)","l10n_hr_coa_rrif_2022.l10n_hr_coa_rrif_2022"
"069000","hr_069000","asset_non_current",0,"Nezarađene kamate u kreditima i sl.","l10n_hr_coa_rrif_2022.l10n_hr_coa_rrif_2022"
"070000","hr_070000","asset_receivable",1,"Potraživanja od poduzetnika unutar grupe","l10n_hr_coa_rrif_2022.l10n_hr_coa_rrif_2022"
"071000","hr_071000","asset_receivable",1,"Potraživanja od društava povezanih sudjelujućim interesom","l10n_hr_coa_rrif_2022.l10n_hr_coa_rrif_2022"
"072000","hr_072000","asset_receivable",1,"Potraživanja od kupaca - dugotrajna","l10n_hr_coa_rrif_2022.l10n_hr_coa_rrif_2022"
"073000","hr_073000","asset_receivable",1,"Potraživanja iz faktoringa","l10n_hr_coa_rrif_2022.l10n_hr_coa_rrif_2022"
"074000","hr_074000","asset_receivable",1,"Potraživanja za jamčevine","l10n_hr_coa_rrif_2022.l10n_hr_coa_rrif_2022"
"075000","hr_075000","asset_receivable",1,"Potraživanja u sporu i rizična potraživanja","l10n_hr_coa_rrif_2022.l10n_hr_coa_rrif_2022"
"076000","hr_076000","asset_receivable",1,"Potraživanja za predujmove za usluge","l10n_hr_coa_rrif_2022.l10n_hr_coa_rrif_2022"
"077000","hr_077000","asset_receivable",1,"Potraživanja od radnika","l10n_hr_coa_rrif_2022.l10n_hr_coa_rrif_2022"
"077100","hr_077100","asset_receivable",1,"Potraživanja od članova društva","l10n_hr_coa_rrif_2022.l10n_hr_coa_rrif_2022"
"077200","hr_077200","asset_receivable",1,"Potraživanja iz ortaštva","l10n_hr_coa_rrif_2022.l10n_hr_coa_rrif_2022"
"077300","hr_077300","asset_receivable",1,"Potraživanja iz predstečajne nagodbe","l10n_hr_coa_rrif_2022.l10n_hr_coa_rrif_2022"
"078000","hr_078000","asset_receivable",1,"Vrijednosno usklađivanje dugotrajnih potraživanja","l10n_hr_coa_rrif_2022.l10n_hr_coa_rrif_2022"
"079000","hr_079000","asset_receivable",1,"Potraživanja za nezarađenu kamatu","l10n_hr_coa_rrif_2022.l10n_hr_coa_rrif_2022"
"080000","hr_080000","asset_non_current",1,"Odgođena porezna imovina s osnove poreznog gubitka","l10n_hr_coa_rrif_2022.l10n_hr_coa_rrif_2022"
"080100","hr_080100","asset_non_current",1,"Odgođena porezna imovina s osnove povećane amortizacije","l10n_hr_coa_rrif_2022.l10n_hr_coa_rrif_2022"
"080200","hr_080200","asset_non_current",1,"Odgođena porezna imovina s osnove otpisa potraživanja","l10n_hr_coa_rrif_2022.l10n_hr_coa_rrif_2022"
"080300","hr_080300","asset_non_current",1,"Odgođena porezna imovina s osnove drugih troškova","l10n_hr_coa_rrif_2022.l10n_hr_coa_rrif_2022"
"081000","hr_081000","asset_receivable",1,"Ostala odgođena porezna imovina","l10n_hr_coa_rrif_2022.l10n_hr_coa_rrif_2022"
"100000","hr_100000","asset_cash",0,"Transakcijski računi u bankama","l10n_hr_coa_rrif_2022.l10n_hr_coa_rrif_2022"
"102000","hr_102000","asset_cash",0,"Blagajne","l10n_hr_coa_rrif_2022.l10n_hr_coa_rrif_2022"
"103000","hr_103000","asset_cash",0,"Devizni računi","l10n_hr_coa_rrif_2022.l10n_hr_coa_rrif_2022"
"106000","hr_106000","asset_cash",0,"Novac za kupnju deviza","l10n_hr_coa_rrif_2022.l10n_hr_coa_rrif_2022"
"108000","hr_108000","asset_cash",0,"Ostala novčana sredstva","l10n_hr_coa_rrif_2022.l10n_hr_coa_rrif_2022"
"109000","hr_109000","asset_cash",0,"Vrijednosno usklađenje depozita u bankama","l10n_hr_coa_rrif_2022.l10n_hr_coa_rrif_2022"
"110000","hr_110000","asset_current",0,"Ulaganja u udjele (dionice) i ostale vrijednosne papire poduzetnika unutar grupe","l10n_hr_coa_rrif_2022.l10n_hr_coa_rrif_2022"
"112000","hr_112000","asset_current",0,"Ulaganja u udjele (dionice) društava povezanih sudjelujućim interesom","l10n_hr_coa_rrif_2022.l10n_hr_coa_rrif_2022"
"112100","hr_112100","asset_current",0,"Ulaganja u ostale vrijednosne papire društava povezanih sudjelujućim interesom","l10n_hr_coa_rrif_2022.l10n_hr_coa_rrif_2022"
"113000","hr_113000","asset_current",0,"Dani zajmovi, depoziti i slično društvima povezanim sudjelujućim interesom","l10n_hr_coa_rrif_2022.l10n_hr_coa_rrif_2022"
"114000","hr_114000","asset_current",0,"Ulaganja u vrijednosne papire","l10n_hr_coa_rrif_2022.l10n_hr_coa_rrif_2022"
"115000","hr_115000","asset_current",0,"Dani zajmovi, depoziti i sl.","l10n_hr_coa_rrif_2022.l10n_hr_coa_rrif_2022"
"116000","hr_116000","asset_current",0,"Potraživanja iz ulaganja u investicijske fondove","l10n_hr_coa_rrif_2022.l10n_hr_coa_rrif_2022"
"117000","hr_117000","asset_current",,"Otkup kratkoročnih potraživanja (faktoring)","l10n_hr_coa_rrif_2022.l10n_hr_coa_rrif_2022"
"117100","hr_117100","asset_current",,"Ulaganje u kratkotrajne eskontne poslove","l10n_hr_coa_rrif_2022.l10n_hr_coa_rrif_2022"
"117200","hr_117200","asset_current",,"Potraživanja za više uplaćeno po kreditnoj kartici","l10n_hr_coa_rrif_2022.l10n_hr_coa_rrif_2022"
"117300","hr_117300","asset_current",,"Potraživanja za isplate avaliranih ili indosiranih mjenica","l10n_hr_coa_rrif_2022.l10n_hr_coa_rrif_2022"
"117400","hr_117400","asset_current",,"Potraživanja po isplaćenim garancijama","l10n_hr_coa_rrif_2022.l10n_hr_coa_rrif_2022"
"117500","hr_117500","asset_current",,"Potraživanja iz preuzetog duga (čl. 96. ZOO)","l10n_hr_coa_rrif_2022.l10n_hr_coa_rrif_2022"
"117600","hr_117600","asset_current",,"Potraživanje po asignacijama, novacijama i sl.","l10n_hr_coa_rrif_2022.l10n_hr_coa_rrif_2022"
"117800","hr_117800","asset_current",,"Ostala financijska imovina","l10n_hr_coa_rrif_2022.l10n_hr_coa_rrif_2022"
"118000","hr_118000","asset_current",0,"Potraživanja u sporu (npr. utužena, u predstečaju ili u stečaju i sl. iz fin. imovine)","l10n_hr_coa_rrif_2022.l10n_hr_coa_rrif_2022"
"119000","hr_119000","asset_current",0,"Vrijednosno usklađivanje financijske imovine - kratkotrajne (analitika po otpisima iz ove skupine računa)","l10n_hr_coa_rrif_2022.l10n_hr_coa_rrif_2022"
"120000","hr_120000","asset_receivable",1,"Potraživanja od kupaca dobara","l10n_hr_coa_rrif_2022.l10n_hr_coa_rrif_2022"
"120100","hr_120100","asset_receivable",1,"Potraživanja od kupaca usluga (servisne, građenje i popravci, najmovi, ustupanje radne snage, kapaciteta i dr.)","l10n_hr_coa_rrif_2022.l10n_hr_coa_rrif_2022"
"120300","hr_120300","asset_receivable",1,"Kupci građani i prodaja na potrošački kredit","l10n_hr_coa_rrif_2022.l10n_hr_coa_rrif_2022"
"120500","hr_120500","asset_receivable",1,"Potraživanja od kupaca za prodanu robu iz komisije","l10n_hr_coa_rrif_2022.l10n_hr_coa_rrif_2022"
"120900","hr_120900","asset_receivable",1,"Potraživanja za nefakturiranu isporuku dobara ili usluga","l10n_hr_coa_rrif_2022.l10n_hr_coa_rrif_2022"
"121000","hr_121000","asset_receivable",1,"Kupci dobara iz EU","l10n_hr_coa_rrif_2022.l10n_hr_coa_rrif_2022"
"121100","hr_121100","asset_receivable",1,"Kupci dobara iz trećih zemalja","l10n_hr_coa_rrif_2022.l10n_hr_coa_rrif_2022"
"121200","hr_121200","asset_receivable",1,"Kupci usluga iz EU","l10n_hr_coa_rrif_2022.l10n_hr_coa_rrif_2022"
"121300","hr_121300","asset_receivable",1,"Kupci usluga iz trećih zemalja","l10n_hr_coa_rrif_2022.l10n_hr_coa_rrif_2022"
"121400","hr_121400","asset_receivable",1,"Kupci prava iz EU","l10n_hr_coa_rrif_2022.l10n_hr_coa_rrif_2022"
"121500","hr_121500","asset_receivable",1,"Kupci prava iz trećih zemalja","l10n_hr_coa_rrif_2022.l10n_hr_coa_rrif_2022"
"121600","hr_121600","asset_receivable",1,"Potraživanja od kupaca povezanih osoba iz EU koje nisu grupa ni društva povezana sudjelujućim interesom","l10n_hr_coa_rrif_2022.l10n_hr_coa_rrif_2022"
"121700","hr_121700","asset_receivable",1,"Potraživanja od kupaca povezanih osoba iz trećih zemalja koje nisu grupa ni društva povezana sudjelujućim interesom","l10n_hr_coa_rrif_2022.l10n_hr_coa_rrif_2022"
"122000","hr_122000","asset_receivable",1,"Potraživanja od poduzetnika unutar grupe za isporučene robe i usluge","l10n_hr_coa_rrif_2022.l10n_hr_coa_rrif_2022"
"123000","hr_123000","asset_receivable",1,"Potraživanja od društava povezanih sudjelujućim interesom za isporučene robe i usluge","l10n_hr_coa_rrif_2022.l10n_hr_coa_rrif_2022"
"124000","hr_124000","asset_receivable",1,"Potraživanja za ugovorene kamate (koje nisu pripisane glavnici)","l10n_hr_coa_rrif_2022.l10n_hr_coa_rrif_2022"
"124100","hr_124100","asset_receivable",1,"Potraživanja za zatezne kamate (koje nisu pripisane glavnici)","l10n_hr_coa_rrif_2022.l10n_hr_coa_rrif_2022"
"124200","hr_124200","asset_receivable",1,"Potraživanja za kamate po nagodbama","l10n_hr_coa_rrif_2022.l10n_hr_coa_rrif_2022"
"124300","hr_124300","asset_receivable",1,"Potraživanje za kamatu iz danih zajmova","l10n_hr_coa_rrif_2022.l10n_hr_coa_rrif_2022"
"124500","hr_124500","asset_receivable",1,"Kamate iz ostalih tražbina","l10n_hr_coa_rrif_2022.l10n_hr_coa_rrif_2022"
"125000","hr_125000","asset_receivable",1,"Potraživanja za predujmljene usluge s PDV-om","l10n_hr_coa_rrif_2022.l10n_hr_coa_rrif_2022"
"125100","hr_125100","asset_receivable",1,"Potraživanja za predujmljene usluge bez PDV-a (npr. graditeljske)","l10n_hr_coa_rrif_2022.l10n_hr_coa_rrif_2022"
"126000","hr_126000","asset_receivable",1,"Potraživanja po poslovima uvoza za tuđi račun","l10n_hr_coa_rrif_2022.l10n_hr_coa_rrif_2022"
"127000","hr_127000","asset_receivable",1,"Potraživanja s osnove prodaje udjela i dionica","l10n_hr_coa_rrif_2022.l10n_hr_coa_rrif_2022"
"127100","hr_127100","asset_receivable",1,"Potraživanja za nakladno odobrene popuste (bonifikacije, cassa sconto, rabat i sl.)","l10n_hr_coa_rrif_2022.l10n_hr_coa_rrif_2022"
"127200","hr_127200","asset_receivable",1,"Potraživanja za predujam za kupnju dionica i udjela","l10n_hr_coa_rrif_2022.l10n_hr_coa_rrif_2022"
"127300","hr_127300","asset_receivable",1,"Potraživanja od komisionara","l10n_hr_coa_rrif_2022.l10n_hr_coa_rrif_2022"
"127400","hr_127400","asset_receivable",1,"Potraživanja za povrat PDV-a iz EU","l10n_hr_coa_rrif_2022.l10n_hr_coa_rrif_2022"
"127500","hr_127500","asset_receivable",1,"Potraživanja za odobrene državne potpore","l10n_hr_coa_rrif_2022.l10n_hr_coa_rrif_2022"
"127600","hr_127600","asset_receivable",1,"Potraživanja za PDV iz naknadno odobrenog popusta","l10n_hr_coa_rrif_2022.l10n_hr_coa_rrif_2022"
"127800","hr_127800","asset_receivable",1,"Potraživanja za dividendu - dobitak","l10n_hr_coa_rrif_2022.l10n_hr_coa_rrif_2022"
"127900","hr_127900","asset_receivable",1,"Potraživanja za povrat PDV-a iz trećih zemalja","l10n_hr_coa_rrif_2022.l10n_hr_coa_rrif_2022"
"128000","hr_128000","asset_receivable",1,"Ostala kratkoročna potraživanja","l10n_hr_coa_rrif_2022.l10n_hr_coa_rrif_2022"
"129000","hr_129000","asset_receivable",1,"Vrijednosno usklađenje potraživanja","l10n_hr_coa_rrif_2022.l10n_hr_coa_rrif_2022"
"131000","hr_131000","asset_receivable",1,"Potraživanja od vanjskih suradnika","l10n_hr_coa_rrif_2022.l10n_hr_coa_rrif_2022"
"133000","hr_133000","asset_receivable",1,"Potraživanja od članova društva za predujmljeni dobitak - dividendu (+ porez 10% i prirez)","l10n_hr_coa_rrif_2022.l10n_hr_coa_rrif_2022"
"133100","hr_133100","asset_receivable",1,"Potraživanja od članova društva za privatne troškove","l10n_hr_coa_rrif_2022.l10n_hr_coa_rrif_2022"
"133400","hr_133400","asset_receivable",1,"Potraživanje od obrtnika (dobitaša)","l10n_hr_coa_rrif_2022.l10n_hr_coa_rrif_2022"
"133500","hr_133500","asset_receivable",1,"Potraživanja od prodaje članu društva","l10n_hr_coa_rrif_2022.l10n_hr_coa_rrif_2022"
"134000","hr_134000","asset_receivable",1,"Potraživanja za glavnicu","l10n_hr_coa_rrif_2022.l10n_hr_coa_rrif_2022"
"135000","hr_135000","asset_receivable",1,"Potraživanja za sredstva u slobodnoj zoni","l10n_hr_coa_rrif_2022.l10n_hr_coa_rrif_2022"
"136000","hr_136000","asset_receivable",1,"Potraživanja za prodaju na potrošački kredit","l10n_hr_coa_rrif_2022.l10n_hr_coa_rrif_2022"
"137000","hr_137000","asset_receivable",1,"Potraživanja od poslovnih jedinica u inozemstvu","l10n_hr_coa_rrif_2022.l10n_hr_coa_rrif_2022"
"138000","hr_138000","asset_receivable",1,"Ostala poslovna potraživanja","l10n_hr_coa_rrif_2022.l10n_hr_coa_rrif_2022"
"139000","hr_139000","asset_receivable",1,"Vrijednosno usklađenje potraživanja od zaposlenih, članova društva i ostalih potraživanja","l10n_hr_coa_rrif_2022.l10n_hr_coa_rrif_2022"
"140010","hr_140010","asset_current",0,"Pretporez - 5%","l10n_hr_coa_rrif_2022.l10n_hr_coa_rrif_2022"
"140011","hr_140011","asset_current",0,"Pretporez - 13%","l10n_hr_coa_rrif_2022.l10n_hr_coa_rrif_2022"
"140012","hr_140012","asset_current",0,"Pretporez - 25%","l10n_hr_coa_rrif_2022.l10n_hr_coa_rrif_2022"
"140020","hr_140020","asset_current",0,"Pretporez iz predujmova - 5%","l10n_hr_coa_rrif_2022.l10n_hr_coa_rrif_2022"
"140021","hr_140021","asset_current",0,"Pretporez iz predujmova - 13%","l10n_hr_coa_rrif_2022.l10n_hr_coa_rrif_2022"
"140022","hr_140022","asset_current",0,"Pretporez iz predujmova - 25%","l10n_hr_coa_rrif_2022.l10n_hr_coa_rrif_2022"
"140030","hr_140030","asset_current",0,"Ispravak pretporeza zbog izlaska iz sustava PDV-a","l10n_hr_coa_rrif_2022.l10n_hr_coa_rrif_2022"
"140031","hr_140031","asset_current",0,"Ispravak pretporeza zbog prenamjene dobara (oslobođene isporuke)","l10n_hr_coa_rrif_2022.l10n_hr_coa_rrif_2022"
"140032","hr_140032","asset_current",0,"Ispravak pretporeza zbog promjene postotka priznavanja pretporeza - usklađenje","l10n_hr_coa_rrif_2022.l10n_hr_coa_rrif_2022"
"140100","hr_140100","asset_current",0,"Pretporez od predujmova iz prenesene porezne obveze - 25%","l10n_hr_coa_rrif_2022.l10n_hr_coa_rrif_2022"
"140200","hr_140200","asset_current",0,"Pretporez od stjecanja dobara iz EU - 5%","l10n_hr_coa_rrif_2022.l10n_hr_coa_rrif_2022"
"140210","hr_140210","asset_current",0,"Pretporez od stjecanja dobara iz EU - 13%","l10n_hr_coa_rrif_2022.l10n_hr_coa_rrif_2022"
"140220","hr_140220","asset_current",0,"Pretporez od stjecanja dobara iz EU - 25%","l10n_hr_coa_rrif_2022.l10n_hr_coa_rrif_2022"
"140300","hr_140300","asset_current",0,"Pretporez od primljenih usluga iz EU - 5%","l10n_hr_coa_rrif_2022.l10n_hr_coa_rrif_2022"
"140310","hr_140310","asset_current",0,"Pretporez od primljenih usluga iz EU - 13%","l10n_hr_coa_rrif_2022.l10n_hr_coa_rrif_2022"
"140320","hr_140320","asset_current",0,"Pretporez od primljenih usluga iz EU - 25%","l10n_hr_coa_rrif_2022.l10n_hr_coa_rrif_2022"
"140400","hr_140400","asset_current",0,"Pretporez od poreznih obveznika bez sjedišta u RH - 5%","l10n_hr_coa_rrif_2022.l10n_hr_coa_rrif_2022"
"140410","hr_140410","asset_current",0,"Pretporez od poreznih obveznika bez sjedišta u RH - 13%","l10n_hr_coa_rrif_2022.l10n_hr_coa_rrif_2022"
"140420","hr_140420","asset_current",0,"Pretporez od poreznih obveznika bez sjedišta u RH - 25%","l10n_hr_coa_rrif_2022.l10n_hr_coa_rrif_2022"
"140500","hr_140500","asset_current",0,"PDV pri uvozu dobara - 5%","l10n_hr_coa_rrif_2022.l10n_hr_coa_rrif_2022"
"140510","hr_140510","asset_current",0,"PDV pri uvozu dobara - 13%","l10n_hr_coa_rrif_2022.l10n_hr_coa_rrif_2022"
"140520","hr_140520","asset_current",0,"PDV pri uvozu dobara - 25%","l10n_hr_coa_rrif_2022.l10n_hr_coa_rrif_2022"
"140600","hr_140600","asset_current",0,"Pretporez stečen po ugovoru o asignaciji ili iz preknjižavanja","l10n_hr_coa_rrif_2022.l10n_hr_coa_rrif_2022"
"140700","hr_140700","asset_current",0,"Potraživanja za razliku većeg pretporeza od obveza u razdoblju oporezivanja","l10n_hr_coa_rrif_2022.l10n_hr_coa_rrif_2022"
"140800","hr_140800","asset_current",0,"Pretporez koji još nije moguće priznati","l10n_hr_coa_rrif_2022.l10n_hr_coa_rrif_2022"
"140801","hr_140801","asset_current",0,"Pretporez za koji nije stečen uvjet za priznavanje","l10n_hr_coa_rrif_2022.l10n_hr_coa_rrif_2022"
"141000","hr_141000","asset_receivable",1,"Potraživanja za porez i prirez na dohodak iz plaća i drugih primanja","l10n_hr_coa_rrif_2022.l10n_hr_coa_rrif_2022"
